{
  "formatVersion": 1,
  "packId": "prototype-v1-2026-09-22",
  "generatedBy": "water-sort-level-generator",
  "levels": [
    {
      "id": "v3-baseline-easy-0005",
      "difficulty": "easy",
      "capacity": 4,
      "board": [
        [
          1,
          1,
          0,
          0
        ],
        [
          2,
          2,
          0,
          0
        ],
        [
          1,
          2,
          3,
          1
        ],
        [
          2,
          3,
          3,
          3
        ],
        [],
        []
      ],
      "metadata": {
        "optimalMoves": 8,
        "sourceCatalog": "baseline"
      }
    },
    {
      "id": "v3-baseline-easy-0010",
      "difficulty": "easy",
      "capacity": 4,
      "board": [
        [
          2,
          3,
          3,
          1
        ],
        [
          3,
          0,
          2,
          2
        ],
        [
          2,
          0,
          0,
          0
        ],
        [
          1,
          3,
          1,
          1
        ],
        []
      ],
      "metadata": {
        "optimalMoves": 9,
        "sourceCatalog": "baseline"
      }
    },
    {
      "id": "v3-baseline-easy-0011",
      "difficulty": "easy",
      "capacity": 4,
      "board": [
        [
          2,
          0,
          1,
          2
        ],
        [
          0,
          0,
          3,
          3
        ],
        [
          3,
          0,
          2,
          2
        ],
        [
          1,
          1,
          1,
          3
        ],
        [],
        []
      ],
      "metadata": {
        "optimalMoves": 9,
        "sourceCatalog": "baseline"
      }
    },
    {
      "id": "v3-baseline-easy-0013",
      "difficulty": "easy",
      "capacity": 4,
      "board": [
        [
          3,
          0,
          3,
          0
        ],
        [
          0,
          1,
          2,
          2
        ],
        [
          3,
          3,
          2,
          2
        ],
        [
          1,
          0,
          1,
          1
        ],
        []
      ],
      "metadata": {
        "optimalMoves": 9,
        "sourceCatalog": "baseline"
      }
    },
    {
      "id": "v3-baseline-easy-0002",
      "difficulty": "easy",
      "capacity": 4,
      "board": [
        [
          3,
          0,
          1,
          1
        ],
        [
          1,
          3,
          3,
          0
        ],
        [
          0,
          1,
          2,
          2
        ],
        [
          2,
          0,
          3,
          2
        ],
        []
      ],
      "metadata": {
        "optimalMoves": 10,
        "sourceCatalog": "baseline"
      }
    },
    {
      "id": "v3-baseline-easy-0004",
      "difficulty": "easy",
      "capacity": 4,
      "board": [
        [
          3,
          3,
          1,
          1
        ],
        [
          0,
          3,
          1,
          2
        ],
        [
          2,
          2,
          1,
          2
        ],
        [
          0,
          3,
          0,
          0
        ],
        [],
        []
      ],
      "metadata": {
        "optimalMoves": 10,
        "sourceCatalog": "baseline"
      }
    },
    {
      "id": "v3-baseline-easy-0007",
      "difficulty": "easy",
      "capacity": 4,
      "board": [
        [
          1,
          1,
          3,
          0
        ],
        [
          0,
          3,
          3,
          2
        ],
        [
          2,
          2,
          1,
          2
        ],
        [
          1,
          0,
          3,
          0
        ],
        [],
        []
      ],
      "metadata": {
        "optimalMoves": 11,
        "sourceCatalog": "baseline"
      }
    },
    {
      "id": "v3-baseline-easy-0016",
      "difficulty": "easy",
      "capacity": 4,
      "board": [
        [
          1,
          1,
          0,
          3
        ],
        [
          0,
          1,
          0,
          3
        ],
        [
          1,
          2,
          0,
          2
        ],
        [
          3,
          3,
          2,
          2
        ],
        [],
        []
      ],
      "metadata": {
        "optimalMoves": 11,
        "sourceCatalog": "baseline"
      }
    },
    {
      "id": "v3-baseline-easy-0017",
      "difficulty": "easy",
      "capacity": 4,
      "board": [
        [
          0,
          0,
          3,
          1
        ],
        [
          1,
          2,
          2,
          1
        ],
        [
          1,
          2,
          3,
          2
        ],
        [
          0,
          3,
          3,
          0
        ],
        [],
        []
      ],
      "metadata": {
        "optimalMoves": 11,
        "sourceCatalog": "baseline"
      }
    },
    {
      "id": "v3-baseline-easy-0003",
      "difficulty": "easy",
      "capacity": 4,
      "board": [
        [
          3,
          2,
          2,
          0
        ],
        [
          1,
          0,
          1,
          3
        ],
        [
          0,
          1,
          1,
          0
        ],
        [
          2,
          3,
          2,
          3
        ],
        [],
        []
      ],
      "metadata": {
        "optimalMoves": 12,
        "sourceCatalog": "baseline"
      }
    },
    {
      "id": "v3-baseline-easy-0009",
      "difficulty": "easy",
      "capacity": 4,
      "board": [
        [
          0,
          1,
          2,
          3
        ],
        [
          3,
          3,
          2,
          3
        ],
        [
          2,
          1,
          1,
          2
        ],
        [
          0,
          1,
          0,
          0
        ],
        []
      ],
      "metadata": {
        "optimalMoves": 12,
        "sourceCatalog": "baseline"
      }
    },
    {
      "id": "v3-baseline-easy-0015",
      "difficulty": "easy",
      "capacity": 4,
      "board": [
        [
          3,
          1,
          0,
          0
        ],
        [
          1,
          2,
          2,
          3
        ],
        [
          1,
          0,
          3,
          0
        ],
        [
          2,
          1,
          3,
          2
        ],
        [],
        []
      ],
      "metadata": {
        "optimalMoves": 12,
        "sourceCatalog": "baseline"
      }
    },
    {
      "id": "v3-baseline-easy-0019",
      "difficulty": "easy",
      "capacity": 4,
      "board": [
        [
          1,
          3,
          3,
          1
        ],
        [
          1,
          2,
          0,
          0
        ],
        [
          0,
          2,
          0,
          3
        ],
        [
          1,
          2,
          2,
          3
        ],
        [],
        []
      ],
      "metadata": {
        "optimalMoves": 12,
        "sourceCatalog": "baseline"
      }
    },
    {
      "id": "v3-expanded-easy-0005",
      "difficulty": "easy",
      "capacity": 4,
      "board": [
        [
          0,
          4,
          2,
          2
        ],
        [
          1,
          1,
          3,
          3
        ],
        [
          4,
          2,
          4,
          1
        ],
        [
          2,
          0,
          1,
          0
        ],
        [
          0,
          4,
          3,
          3
        ],
        [],
        []
      ],
      "metadata": {
        "optimalMoves": 12,
        "sourceCatalog": "expanded"
      }
    },
    {
      "id": "v3-expanded-easy-0009",
      "difficulty": "easy",
      "capacity": 4,
      "board": [
        [
          2,
          2,
          4,
          4
        ],
        [
          0,
          1,
          2,
          1
        ],
        [
          3,
          3,
          1,
          0
        ],
        [
          1,
          4,
          0,
          4
        ],
        [
          0,
          2,
          3,
          3
        ],
        [],
        []
      ],
      "metadata": {
        "optimalMoves": 12,
        "sourceCatalog": "expanded"
      }
    },
    {
      "id": "v3-expanded-easy-0015",
      "difficulty": "easy",
      "capacity": 4,
      "board": [
        [
          1,
          1,
          4,
          2
        ],
        [
          1,
          3,
          4,
          1
        ],
        [
          4,
          4,
          3,
          3
        ],
        [
          0,
          2,
          2,
          0
        ],
        [
          3,
          2,
          0,
          0
        ],
        [],
        []
      ],
      "metadata": {
        "optimalMoves": 12,
        "sourceCatalog": "expanded"
      }
    },
    {
      "id": "v3-baseline-easy-0008",
      "difficulty": "easy",
      "capacity": 4,
      "board": [
        [
          1,
          3,
          1,
          0
        ],
        [
          0,
          2,
          3,
          0
        ],
        [
          2,
          2,
          3,
          1
        ],
        [
          3,
          2,
          1,
          0
        ],
        [],
        []
      ],
      "metadata": {
        "optimalMoves": 13,
        "sourceCatalog": "baseline"
      }
    },
    {
      "id": "v3-baseline-easy-0014",
      "difficulty": "easy",
      "capacity": 4,
      "board": [
        [
          2,
          1,
          3,
          0
        ],
        [
          1,
          2,
          0,
          3
        ],
        [
          0,
          3,
          2,
          0
        ],
        [
          2,
          3,
          1,
          1
        ],
        [],
        []
      ],
      "metadata": {
        "optimalMoves": 13,
        "sourceCatalog": "baseline"
      }
    },
    {
      "id": "v3-baseline-easy-0018",
      "difficulty": "easy",
      "capacity": 4,
      "board": [
        [
          3,
          3,
          0,
          1
        ],
        [
          0,